fold_id,cv_tag,html_id,sent_id,CONTENT,CLASS
9,cv956,12547,50,maria pitillo ( dear god ) plays the love interest and hank azaria ( great expectations ) is on hand to present what is supposed to be comic relief .,neg
9,cv956,12547,51,"ultimately , it doesn't really matter what i ( or any other critic , for that matter ) have to say about the movie .",neg
9,cv956,12547,52,"tristar has assumed that godzilla , like all self-proclaimed summer event motion pictures , is pretty much critic-proof .",neg
9,cv956,12547,53,it may also be word-of-mouth-proof .,neg
9,cv956,12547,54,those who want to see the movie will see it no matter what i write or their friends say .,neg
9,cv956,12547,55,"so , when i go on record to assert that godzilla is one of the most idiotic blockbuster movies of all time , it's like spitting into the wind .",neg
9,cv956,12547,56,"emmerich and devlin are master illusionists , waving their wands and mesmerizing audiences with their smoke and mirrors .",neg
9,cv956,12547,57,"it's probably too much to hope that some day , movie-goers will wake up and realize that they've been had .",neg
9,cv957,9059,0,recently one night a young director named baz luhrmann couldn't sleep .,neg
9,cv957,9059,1,he tumbled out of bed and moved over to the television where he watched mtv for an hour .,neg
9,cv957,9059,2,then he moved to his kitchen where he spent the same amount of time eating spoiled food .,neg
9,cv957,9059,3,then he took down a volume of shakespeare's work and read it cover to cover - never really paying attention to the words or plot .,neg
9,cv957,9059,4,"and then , as a climax , he took out his video camera and pressed the "" on "" button .",neg
9,cv957,9059,5,the result ?,neg
9,cv957,9059,6,william shakespeare's romeo + juliet - the worst film ever made and a complete failure .,neg
9,cv957,9059,7,"though , to be fair , an interesting complete failure .",neg
9,cv957,9059,8,the idea at the film's core is to make shakespeare appealing to the crowds .,neg
9,cv957,9059,9,this is done by moving the camera around at a rapid rate so that we can't see what is going on .,neg
9,cv957,9059,10,and filming the dialogue in voice over .,neg
9,cv957,9059,11,and shooting leonardo dicaprio like a calvin klein model .,neg
9,cv957,9059,12,and making the frame go still while flashing the character's name at the bottom .,neg
9,cv957,9059,13,and filming long tedious action sequences in slow motion .,neg
9,cv957,9059,14,"i mean , man , this is the 90s , dude .",neg
9,cv957,9059,15,however i've seen terrible films that are fun to watch .,neg
9,cv957,9059,16,( examples are batman and robin and the island of doctor moreau .,neg
9,cv957,9059,17,) that rule doesn't apply here .,neg
9,cv957,9059,18,this is a film that takes itself seriously .,neg
9,cv957,9059,19,that is it's major fault .,neg
9,cv957,9059,20,"another problem was pointed out by my friend , alex ( who was singing songs by leonard bernstein throughout .",neg
9,cv957,9059,21,) ; the original play is a powerful piece of work because the author remained neutral and didn't take sides .,neg
9,cv957,9059,22,here it's clear that we are supposed to side with romeo .,neg
9,cv957,9059,23,( just look at the way they film him .,neg
9,cv957,9059,24,) from the begining he's our hero and this doesn't work .,neg
9,cv957,9059,25,and dicaprio's awful performance doesn't help .,neg
9,cv957,9059,26,luhrmann never decides if he wants to entertain us or enlighten us .,neg
9,cv957,9059,27,the result is a mess .,neg
9,cv957,9059,28,you can feel him striving to be something he isn't .,neg
9,cv957,9059,29,he tries to pull of a mix in which drag queens are filmed from purposefully arty angles .,neg
9,cv957,9059,30,he tries very hard .,neg
9,cv957,9059,31,key word : tries .,neg
9,cv957,9059,32,""" oh look , he's filming above water action from below .",neg
9,cv957,9059,33,pretty .,neg
9,cv957,9059,34,"what does it represent ? """,neg
9,cv957,9059,35,why do people do ugly things ?,neg
9,cv957,9059,36,i scrambled away from my tv set feeling guilty as if i could never read the play again and keep a straight face .,neg
9,cv958,13020,0,in times of crisis people are driven to desperate measures .,neg
9,cv958,13020,1,of course what constitutes a crisis differs from person to person .,neg
9,cv958,13020,2,"what may be a disastrous situation for one , may be seen as a challenge to another .",neg
9,cv958,13020,3,"as deepak chopra is known to say , "" it's not the ride , it's the rider . """,neg
9,cv958,13020,4,unfortunately clear-thinking is not always the reaction to problems .,neg
9,cv958,13020,5,wall street wheeler dealer steven taylor ( michael douglas ) is a man with troubles .,neg
9,cv958,13020,6,he's sunk his money in illegal financial activities and it's blown up in his face .,neg
9,cv958,13020,7,in a matter of days he will lose it all .,neg
9,cv958,13020,8,his wife emily ( gwyneth paltrow ) is a highly-placed un interpreter and is not happy with her life either .,neg
9,cv958,13020,9,her marriage is cold and unfulfilling .,neg
9,cv958,13020,10,"unknown to her , her new lover david shaw ( viggo mortensen ) is not only a painter , but an ex-con with a history of bilking wealthy women of their money .",neg
9,cv958,13020,11,emily is a prime target : she's worth over $100 million .,neg
9,cv958,13020,12,steven's solution to his predicament is to offer david half a million to kill his wife .,neg
9,cv958,13020,13,the artist accepts and the movie is underway .,neg
9,cv958,13020,14,"drawing from frederick knott's play and loosely based on hitchcock's dial m for murder , this is all-too typical of summer releases .",neg
9,cv958,13020,15,all style and no substance .,neg
9,cv958,13020,16,and there's really not much style .,neg
9,cv958,13020,17,director andrew davis ( the accomplished witness and best-forgotten other films ) has made exactly the wrong choices at almost every turn .,neg
9,cv958,13020,18,douglas and paltrow have both shown us that they are skillful actors in previous films .,neg
9,cv958,13020,19,mortensen showed promise in the past .,neg
9,cv958,13020,20,here all three are walking uninterestingly through their roles with oddly waxen faces .,neg
9,cv958,13020,21,the only person who shows any sense of life is david suchet as new york detective mohamed karaman .,neg
9,cv958,13020,22,he's only on-screen long enough to make you think that there might be a likable person in the film and then he disappears .,neg
9,cv958,13020,23,the first concern of a suspense film is to create suspense .,neg
9,cv958,13020,24,surprises are important .,neg
9,cv958,13020,25,in this movie the audience keeps waiting for something to happen .,neg
9,cv958,13020,26,and nothing ever does .,neg
9,cv958,13020,27,nearly every event is telegraphed in advance .,neg
9,cv958,13020,28,close-up on this object or that action and it's easy to guess what's going to happen .,neg
9,cv958,13020,29,as the film plods towards its inevitable conclusion you keep expecting a plot twist to make the movie worthwhile .,neg
9,cv958,13020,30,it's a hopeless quest .,neg
9,cv958,13020,31,the story doesn't make much sense .,neg
9,cv958,13020,32,steven's wife is loaded .,neg
9,cv958,13020,33,"even with unfriendly relations , you'd think that he could have talked to her about his difficulty rather than deciding to kill her .",neg
9,cv958,13020,34,when he does decide on the dire plan he makes an unreasonable choice .,neg
9,cv958,13020,35,"if you were going to hire someone to kill your wife , would your first choice be her lover ?",neg
9,cv958,13020,36,"no matter how sleazy he is , i would think there might be a chance that he would turn down the opportunity .",neg
9,cv958,13020,37,why would steven plan the murder as a break-in in their apartment ?,neg
9,cv958,13020,38,why not just take her out as she was walking to david's loft in a bad neighborhood ?,neg
9,cv958,13020,39,"while deciding among the numerous summer films , you might do well to skip this one .",neg
9,cv958,13020,40,you'll find more suspense than this movie offers by watching the weather channel .,neg
9,cv959,16218,0,""" virus "" is a monster movie without a monster .",neg
9,cv959,16218,1,any movie with a hurdle that large to overcome had better be pretty damn good otherwise .,neg
9,cv959,16218,2,"sadly , "" virus "" does not deliver , on any level .",neg
9,cv959,16218,3,the movie opens with the russian space station mir about to transmit something ( we never find out what ) to a big boat with lots of satellites on it .,neg
9,cv959,16218,4,"sudddenly , a wave of colorful lightning comes flying through space , and winds up destroying mir and using it to transmit itself to the aforementioned big boat .",neg
9,cv959,16218,5,"cut to seven days later , we meet donald sutherland and his band of seafaring vultures .",neg
9,cv959,16218,6,"see , they spend all their time sailing around looking for dead-in-the-water ships to rescue , and then collect the reward money .",neg
9,cv959,16218,7,"at least , i * think * that's what they do .",neg
9,cv959,16218,8,"along with many other things in the film , their reason for being out in the middle of the ocean isn't really explained .",neg
9,cv959,16218,9,"so , they stumble upon this big boat with lots of satellites on it , and decide to haul it back to russian waters .",neg
9,cv959,16218,10,"the only problem is , the crew starts disappearing one-by-one and turning into borg .",neg
9,cv959,16218,11,"yes , borg .",neg
9,cv959,16218,12,complete with the red laser beam in place of an eye .,neg
9,cv959,16218,13,"apparently , this alien lifeform can only survive if inside something electrical .",neg
9,cv959,16218,14,"so , it creates make-shift machines and uses humans for "" spare parts "" .",neg
9,cv959,16218,15,"blah , blah , blah .",neg
9,cv959,16218,16,"i could go on forever describing the ludicrous so-called plot , but i won't .",neg
9,cv959,16218,17,suffice it to say the most original thing about this movie is having donald sutherland play an irish man ( ! ) .,neg
9,cv959,16218,18,everything else in this movie has been taken from other ( better ) movies .,neg
9,cv959,16218,19,"for example , many of the machines resemble those found in the little-seen japanese movie , "" tetsuo-the iron man "" .",neg
9,cv959,16218,20,"and the plot is right out of "" aliens "" .",neg
9,cv959,16218,21,"the funny thing is , i was actually expecting to enjoy this movie .",neg
9,cv959,16218,22,"i have a soft spot for cheesy monster movies , like last years under-appreciated "" deep rising "" .",neg
9,cv959,16218,23,"but "" virus "" , as i mentioned earlier , doesn't even have a monster .",neg
9,cv959,16218,24,it just has a big pile of circuits and wires and expects the audience to fear this ridiculous looking contraption .,neg
9,cv959,16218,25,""" virus "" is the type of movie that really makes you wonder what the screenwriter was thinking about when he wrote it .",neg
9,cv959,16218,26,"besides the lame "" monster "" , it's chock full of dialogue that no real person would ever say , and situations that no real person would ever allow themselves to get into .",neg
9,cv959,16218,27,"for example , there is a scene late in the movie in which one of the characters actually attempts to * negotiate * with the alien !",neg
9,cv959,16218,28,"now , i don't know about you , but if i came upon a lifeform that viewed mankind as a virus to be eliminated , i doubt that i would attempt to reason with it .",neg
9,cv959,16218,29,that makes about as much sense as a baby squirrel calmly asking a fierce predator to spare his life .,neg
9,cv959,16218,30,"finally , "" virus "" isn't scary .",neg
9,cv959,16218,31,the least the filmmakers could have done was to make the movie just a little scary .,neg
9,cv959,16218,32,"as it is , it's about as frightening as a box of cookies .",neg
9,cv959,16218,33,"skip "" virus "" .",neg
9,cv959,16218,34,"if it's a cool monster movie you want , rent the far superior ( and the granddaddy of this genre ) "" aliens "" .",neg
9,cv960,28877,0,"dr . alan grant ( sam neill , "" jurassic park "" ) is becoming disillusioned .",neg
9,cv960,28877,1,paleontology is no longer the sexy science it once was since the ingen corporation cloned his subject matter .,neg
9,cv960,28877,2,his lectures bring people interested in his adventures on isla nubla rather than his research and funding dollars are drying up .,neg
9,cv960,28877,3,"when the kirbys ( william h . macy , "" fargo "" ; tea leoni , "" the family man "" ) ask him to be their guide for an anniversary flyover of isla sorna ( the notorious site b of "" the lost world "" ) he's disdainful , but once they wave their checkbook , he reconsiders .",neg
9,cv960,28877,4,"however the kirbys haven't given dr . grant their real agenda in "" jurassic park iii . """,neg
9,cv960,28877,5,"of course , we , the audience , have been tipped off , given that the film begins by showing us eric ( trevor morgan , "" the patriot "" ) , a young boy , and ben ( mark harelik , "" election "" ) going for a paragliding adventure off that same island that goes awry ( and looks like cheesy rear projection ) .",neg
9,cv960,28877,6,"grant's established back home with a new right hand man , billy brennan ( alessandro nivola , "" love's labour's lost "" ) on site at a dig in montana sorely lacking funds .",neg
9,cv960,28877,7,"he also pays a visit to old flame dr . ellie sattler ( laura dern , "" jurassic park "" ) , now married to another with a young son who calls grant 'the dinosaur man' apparently for the sole purpose of dredging her up again for the film's poorly imagined finale .",neg
9,cv960,28877,8,"grant takes billy along on the kirbys trip , which is really an illegal gambit to save their son , that young paraglider .",neg
9,cv960,28877,9,"the couple aren't millionaires , making grant's check bogus , and they're separated as well ( eric was with amanda's new boyfriend , not that that makes much sense ) , meaning we're in for some gooey family dynamics while waiting for the dino dining .",neg
9,cv960,28877,10,"the kirbys hired hands ( and obvious bait ) are a threesome led by mr . udesky ( michael jeter , "" the gift "" ) .",neg
9,cv960,28877,11,( didn't anyone consider that casting michael jeter and william h . macy together and not having them be related was a little odd ? ),neg
9,cv960,28877,12,"as directed by joe johnston ( "" october sky , "" "" jumanji "" ) ( spielberg only produced this one ) from a risible script by peter buchman and the "" election "" team of alexander payne & jim taylor , "" jurassic park iii "" is nothing more than a quickie monster flick with a couple of new dinos ( a spinosauraus , which goes head to head with the t-rex , and pteranodons ) .",neg
9,cv960,28877,13,"the plot , as it were , is a series of coincidences combined with extreme leaps of faith and a trifecta of stupid cell phone tricks .",neg
9,cv960,28877,14,"the effects are no longer new , and , as shot by television cinematographer shelly johnson , rather murky looking at times .",neg
9,cv960,28877,15,"film editing by robert dalva ( "" october sky "" ) was presumably done by machete , to keep this down to a 90 minute run time .",neg
9,cv960,28877,16,"i know of no other reason to explain the ridiculous ending which features the survivors confronting a pack of raptors , then being saved by the most ludicrous of logic jumps within a few minutes .",neg
9,cv960,28877,17,'original' music by don davis just repeats john williams' original themes .,neg
9,cv960,28877,18,"while neill and young morgan attempt to inject some humor and humanity into the proceedings , the rest of the cast are plodding unexceptional .",neg
9,cv960,28877,19,""" jurassic park iii "" will probably provide some quick entertainment for those who go into it knowing what to expect , the same crowd who maybe liked "" the lost world : jurassic park . """,neg
9,cv961,5578,0,"barb wire , pamela anderson lee's first foray into films , highlights the fact that her only talent lies in her silicone enhanced assets .",neg
9,cv961,5578,1,"being the only notable member of the cast , the camera lingers lustily o n her body at every opportunity , making her character's catch line , "" don't call me babe , "" sound very ironic indeed .",neg
9,cv961,5578,2,"from the very opening of the movie , we are treated to a striptease routine from anderson , ending in her hurling her stiletto smack between the eyes of a lusty male who happened to call her babe .",neg
9,cv961,5578,3,"throughout the movie , there is ample footage of enormous breasts and cleavage , if not of anderson's , then at least of the female extras .",neg
9,cv961,5578,4,this alone is enough to retitle the movie babe wire .,neg
9,cv961,5578,5,"for a plot , barb wire rehashes the casablanca storyline .",neg
9,cv961,5578,6,"it is 2017 , the middle of the second american civil war , and barb wire , a former resistance fighter , runs a joint in steel harbour called hammerhead ( ! ! ) .",neg
9,cv961,5578,7,"known for attracting resistance fighters an d characters of all sorts , the bar attracts the attention of the government forces who appear dressed in nazi-style uniforms .",neg
9,cv961,5578,8,"in between bashing up helpless males and showing off her trademark breasts , barb wire has to help a former lover and his wife get to the airport on the other side of the town , past the government-controlled areas , and to freedom .",neg
9,cv961,5578,9,"even the airport looks like the one in casablanca , except that the plane in the background is a modern , private jet .",neg
9,cv961,5578,10,"there are hardly any significant moments in this film , and one gets the impression that it was designed for young teenagers familiar with the dark horse comics version of "" barb wire . """,neg
9,cv961,5578,11,"if anything , one leaves the film with the confirmation that anderson di d not do her own stunts .",neg
9,cv961,5578,12,"who could fight and jump in a skimpy , strapless leather top , and yet keep her breasts from spilling out ?",neg
9,cv961,5578,13,only a stuntwoman .,neg
9,cv961,5578,14,not pamela anderson lee .,neg
9,cv962,9813,0,humanities quest for knowledge never ends .,neg
9,cv962,9813,1,so a team of scientists and film-makers travel to the amazon to search for a legendary indian tribe .,neg
9,cv962,9813,2,"the party consists of anthropologist steven cale ( eric stoltz ) and the camera team consisting of terri flores ( jennifer lopez ) , danny rich ( ice cube ) , gary dixon ( owen wilson ) , denise kahlberg ( kari wuhrer ) and warren westridge ( jonathan hyde ) .",neg
9,cv962,9813,3,early on their journey they meet paul sarone ( jon voight ) whose boat is stuck on the shore .,neg
9,cv962,9813,4,they agree to give him a ride to the next village .,neg
9,cv962,9813,5,he claims to know the area well and can be useful locating the native tribe .,neg
9,cv962,9813,6,very soon their friendliness backfires on the group because sarone turns out to be a snake hunter without scruples who only wants to catch a giant anaconda and sell it to a zoo .,neg
9,cv962,9813,7,we don't have to wait too long for the giant snake .,neg
9,cv962,9813,8,she just had a panther hors d'oevre and now is looking for the main course .,neg
9,cv962,9813,9,our heroes paddle around in the amazonas as if it were the pool in their own backyard .,neg
9,cv962,9813,10,no wonder giant animals mistake their splashing for a dinner bell .,neg
9,cv962,9813,11,our anaconda is a polite one and swallows the first victim in one big gulp .,neg
9,cv962,9813,12,enjoy !,neg
9,cv962,9813,13,so much for the first attempt to catch her .,neg
9,cv962,9813,14,but who would want to catch a giant snake with a fishing pole ?,neg
9,cv962,9813,15,our villain sarone shows his soft side when he stops terri from shooting the snake .,neg
9,cv962,9813,16,too bad that anaconda is just about to strangle another member of the expedition .,neg
9,cv962,9813,17,one by one she goes after the others .,neg
9,cv962,9813,18,eric stoltz is stung by a giant wasp right in the beginning and is mercifully unconcious for the rest of the adventure .,neg
9,cv962,9813,19,the rest of the crew keeps entertaining the viewer although not the way the makers of the movie had planned .,neg
9,cv962,9813,20,however the scenes without the anaconda are rather boring .,neg
9,cv962,9813,21,whenever the leading lady shows up we're in for a laugh .,neg
9,cv962,9813,22,the snake reminds us of a favorite character of a famous animated movie even if she should be an awe-inspiring monster .,neg
9,cv962,9813,23,"her attacks always follow the same plan : one last hypnotic look - she's looking at you , kid - then she speedily wraps herself around her victim and starts to gush it down .",neg
9,cv962,9813,24,mostly we don't see the act of devouring .,neg
9,cv962,9813,25,but she looks nice when she wiggles away with her bulging middle part .,neg
9,cv962,9813,26,whoever did the special effects on this movie may have wanted to go to a zoo first and study some real snakes .,neg
9,cv962,9813,27,maybe then the anaconda model would have looked more real .,neg
9,cv962,9813,28,the animatronics are somewhat more believable .,neg
9,cv962,9813,29,but that didn't work for the strangling scenes .,neg
9,cv962,9813,30,don't go see the movie for the f/x .,neg
9,cv962,9813,31,they are everything but up-to-date .,neg
9,cv962,9813,32,the viewer who likes to watch the end credits will see to his/her surprise that a snake expert was a consultant for the team .,neg
9,cv962,9813,33,we may doubt though that he has ever seen the final result of his work .,neg
9,cv962,9813,34,"a well known american science magazine is also mentioned in the credits , but i will refrain from naming it here to avoid further damage to its reputation .",neg
9,cv962,9813,35,"the majority of viewer will have left the theater as soon as the credits start rolling , anyway .",neg
9,cv962,9813,36,what kind of audience is the target group for this movie ?,neg
9,cv962,9813,37,hard to say .,neg
9,cv962,9813,38,"this can't be a serious horror movie , or can it ?",neg
9,cv962,9813,39,see for yourself .,neg
9,cv963,7208,0,"absolute power , the new film produced and directed by clint eastwood , attempts to be a thriller set in the world of hypocritical presidents and their murderous political staff .",neg
9,cv963,7208,1,it is about as thrilling as a lecture on the mating habits of the south american grasshopper .,neg
9,cv963,7208,2,one can only wonder how an utterly absurd script like the one written by william goldman could have ever interested eastwood .,neg
9,cv963,7208,3,"not only is the plot unbelievable and contrived , but even the writing itself lacks any consistency or intelligence .",neg
9,cv963,7208,4,"continually underestimating the audience , the film gives us information we already know or dont even need .",neg
9,cv963,7208,5,details essential to the story are so improbably convenient they are annoying ( like why would two unprepared secret service men carry two night-vision goggles in their car ? ) .,neg
9,cv963,7208,6,"oddly enough , the initial setup for absolute power offers interesting possibilities .",neg
9,cv963,7208,7,a masterful jewel-thief ( played by clint eastwood ) witnesses the murder of the wife of a powerful millionaire ( played by e . g .,neg
9,cv963,7208,8,marshall ) .,neg
9,cv963,7208,9,"while robbing one of marshalls mansions , he is forced to hide in the bedrooms vault .",neg
9,cv963,7208,10,"there , through a two-way mirror , he sees the wife and another man engage in passionate foreplay .",neg
9,cv963,7208,11,their game of love quickly turns into a violent struggle as the man starts beating the woman .,neg
9,cv963,7208,12,"in self defense , the woman grabs a letter-opener and stabs the man in the elbow .",neg
9,cv963,7208,13,she raises her arm to stab again when she is fatally shot by two secret service men .,neg
9,cv963,7208,14,the man ?,neg
9,cv963,7208,15,he is the president of the united states of america .,neg
9,cv963,7208,16,where does the film go wrong ?,neg
9,cv963,7208,17,it cannot be the acting .,neg
9,cv963,7208,18,"clint eastwood , ed harris and gene hackman as the president give type-cast , but decent performances .",neg
9,cv963,7208,19,"the cinematography is sufficient ; wild and erratic during action sequences , dark and mysterious during psychologically suspenseful scenes , and calm and warm during dramatic dialogue .",neg
9,cv963,7208,20,even the music is not as bombastic as it usually tends to be in the thriller/suspense genre .,neg
9,cv963,7208,21,"the fault clearly lies in the screenplay , and the screenplay alone .",neg
9,cv963,7208,22,"while setting up a story about misuse of power , about the true possessors of that power , and about intrigue and double-crossing , it does not resolve it .",neg
9,cv963,7208,23,not one buildup of suspense is resolved by an exciting climax .,neg
9,cv963,7208,24,"rather , the tense situations are left dangling at the end , giving the viewer an uneasy sense of incompleteness .",neg
9,cv963,7208,25,"an example of this is a very promising and tense buildup of a scene : in an attempt to arrest clint eastwood , the police have set up a trap at a small restaurant .",neg
9,cv963,7208,26,"police officers are everywhere , incognito of course .",neg
9,cv963,7208,27,"at the same time , not one but two hit men are preparing to kill clint eastwood when he arrives .",neg
9,cv963,7208,28,all three parties are unaware of each others presence .,neg
9,cv963,7208,29,"this scene is tremendously exciting and the audience is wondering how clint eastwood , who might suspect this is a trap , will get himself out of this difficult position .",neg
9,cv963,7208,30,"he will probably have a brilliant plan , involving ingenious preparations .",neg
